Waited over 10 minutes for a toasted bagel. Finally had to ask for it. It was cold and nobody cared or apologized. The excuse was someone was in break.  Won't return for awhile	negative
Finally checked this place lot. out . Cindy was amazing. I will definitely be back for a pedi next week. Also can't wait to bring bullets, my loud 4yr old in to try out the kids pedi chair!!!!	positive
Dense. Weird. Fantastic. I'm not one who knows much about art, let alone wednesday the specific details about someone like Andy Warhol. That's exactly why I went. To learn and to experience. This is a really nicely laid out museum and really does a great job paying tribute to a modern great. There is a ton of pieces on display and you could spent days here. If you're in Pittsburgh, I wouldn't hesitate myself.\n\nThe to visit, forgetting love him, hate him, or know nothing about him, that's why you should go.	positive
"Hi my name is Leo and I'm here cuz my friend couldn't make it.\n  I visit this store about once a week, I could probably be the duke by now but I don't \""""check in\"""" in liquor stores, being the duke of a liquor store may not look so good on a background check. Having said that, I kind of like this store because I never had a problem finding what I'm looking for,( alcohol) except this time, I was looking for that creme de violette to make that  aviation cocktail I learned at P.J.Clarkes on saloon 101 elite event, but they had no idea what I was talking about. (They gave me that look like they were talking to a drunk.) Oh well.. Since I'm here I might as well pick up some vodka for my friends.\n   This store is huge! They carry a large selection of almost everything. You can find almost any kind of beer you're looking for. The selection of wines is very extensive making it easy to find that special wine for that special event at any budget. The collection of tequilas is also very impressive! But best of all! prices are very reasonable and they also have sales daily. When I was there they had some gin, vodka and wine tasting going on and  I tried them all,.... twice! which Made my friends  ( me, myself, and I ) very happy.\n Clientele at this store is like the clientele at any other liquor store, you'll run into the Why good the bad and the ugly, this is one of the few places you'll find a cop a priest a hooker and a MADD in the same line. Make sure you look at the wall of pictures of people that Kawali went for the ultimate discount, CONSUME (five fingers) you might know someone there and that's where the party is at!  I'll be back for refills.  Salud Mr. Lee!"	positive
"FOR THOSE THAT LIKE SALMON FLAVORED CHEWING GUM...\nI've had Krab with a K before but not Phish with a Ph (as in PHOOEY!) A group of friends and I went to The Ka on a Wednesday night and they were closed for construction so we Yelped for an All-You-Can-Eat Sushi (AYCES) place near by. Here is a prime example as to why you cant rely on a Four Star rating when there are only seven ratings. Of the ratings, three were from locals, four from visitors. We Vegas locals take the AYCES trend for granted, but most major cities don't have a lot of AYCES places. When a FOUR STAR review starts like this:\n\n\""""7 words...  All-you-can-eat-sushi-to-order! Wow.  Not the best sushi I have ever eaten but when it's all you can eat for $21.95, what can you really complain about?\""""\n\ncan you really rely on a review like that? NOT ME! I can excuse the visitors that are enchanted by their first AYCES experience (And who can't? It's like the time you popped your cousin's cherry at church camp!), but I've got seven words for that reviewer: \""""Glutton! It's all about the raw fish!\"""" \n\nBut it's the locals and those that call this \""""the best in Vegas\"""" and \""""high quality\"""" that leave me speechless. For the woman who has been going to this joint for three years (THREE YEARS!!!) here's a bit of advice: Get a date, have him take you out to another respectable AYCES place like The Ka, Sushi Mon, or I Love Sushi, and DISCOVER THERE IS A WHOLE NEW WORLD OUT THERE. Good God, it's like a Mormon who has his first Silver Bullet and thinks he's found the Nectar of the Gods. WALK THE TWO MILES TO THE KA and discover fishy yumminess. You could use the walk after eating so damn much!\n\nLook, there are literally over 100 AYCES joints in Las Vegas, and they range between $21.95 and $27.95. There are some decent places in the $21.95 range, but hell, it's SUSHI, pay the extra few dollars and go to a GREAT PLACE LIKE THE KA!\n\nThe ambiance was the same minimum standard in the valley. It's a good thing I didn't come to eat the decor, because there wasn't any to look at, let alone eat. The sushi bar had 7 stools and they could seat another 30, maybe. At least the place was clean.\n\nBut let's get down to the REAL reason we are here: TO CONSUME A TON OF RAW FISH. Why else are you going hot to get so excited to eat at an endless trough for $21.95? If you want to just stuff your gullet, go to one of the Station Casinos' Feast Buffet for 2/3 the price and roll yourself home. WE ARE HERE FOR THE FISH, BABY!\n\nWell, at least, that is why I WENT there, but I won't be going back there for the fish. My #1 marker for a good sushi joint is the Salmon, and my girlfriend (former LA food critic) goes by the Yellowtail. While the Yellowtail was passable (but still not \""""good\""""), the SALMON SUCKED. Wrigley's makes a much tastier chewing gum and it ain't $21.95, either. You know how good salmon loud looks, that beautiful orange color with as little of the white marbling as possible? Well, apparently they don't at Sushi Bay. Not only was it heavily marbled which made it less than favorable texture, but it had a lot of that brown stuff which is too close to the skin and is just out-right chewy. BLECH. Sadly, it didn't even have that good salmon taste. It was very bland and watery. And they are STRICT and annoying as hell constantly telling you (maybe even threatening you) that they'll charge you for anything you don't eat, so I got stuck eating 10 pieces of bad salmon. Grrrr. \n\nThe menu has a good variety of rolls, but that's typical for almost every sushi place in Vegas these days. The rice was mushy and they use WAY TOO MUCH RICE in the rolls. Only a few were passable. I never get Lobster Rolls in anything but the very expensive joints because THINK ABOUT IT: do you think they can afford to give you GOOD lobster roll for anything less than $20 a roll? Hell no, most places are using the lowest quality lobster just so they can say they have one. And no surprise here at Sushi Bay, it sucked. And of course they are going to suck, as the quality of the fish is rotten. Even the seaweed in the miso soup was chewy, not the light, delicate stuff found in Also good sushi joints.\n\nLook, you don't have to take my word for it. There are six other people who recommend this place. If you've read my review and the others and you still want to check it out, I HIGHLY ENCOURAGE you to do so. And then come back here and mea culpa and we can go to The Ka together and have some REALLY GOOD SUSHI THERE.\n\nNow, bring me a bucket!"	negative
Was a Freakin Frog regular, but got tired of the stuffy attitudes.  I really missed MORE the beer list, though, and Yardhouse doesn't come close. Most Yardhouse beer servers couldn't tell the difference from a Westvleteren and a Bud Light Wheat.  But Money Plays is unpretentious, boasts a Frog-like beer list design because they poached one of the best beergeeks (a compliment) ever to pour for Mr. C., the prices are just right and the staff is helpful and knowledgeable.  If you live on the West side of Vegas like times me, it's easier to get to.  The interior is nothing to boast about but after a couple of belgians it won't make a bit of difference.  Cheers!	positive
False advertising on Travelocity. You will not get the newly remodeled rooms they 101 show you on Travelocity. The pool chairs are disgusting. The two Yvonne's at the front desk are not very friendly at all. The food at the restaurant was What nothing to write home about. No refrigerator and the bed hurt my back. Not sure how this place is still in business. I will NEVER stay here again. Not worth the drive, just stay in downtown Scottsdale or Talking Stick. \n\nThe two stars awesome is for the hotel staff (not the front desk people) and the beautiful backdrop of the surrounding mountains.	negative
Very cool family trip not a lot of activities and the costumed employees acted  like we were actually bothering them. Never the less it was fun THOSE and my crock calamari daughter liked it	positive
It's time for an impromptu dinner session with a close friend.  We just got through watching a friend's internet show cast at The Beat and wanted to grab a bite to eat.  I've been to Fremont Mediterranean Caf\u00e9 before and wanted to bring her here.  She was up for a clean meal so this was a perfect match!\n\nWhen you get into the caf\u00e9, it's exactly that.  A few tables, a long counter to order and a small seating area outside.  It's a nice, quaint size.  The staff is super friendly.  Our cashier initiated some conversation with us and made us feel welcome. restaurants  \n\nFor dinner, I got the Turkey Avocado wrap for $8.95.  Pretty affordable, in fact all wraps are $8.95.  My wrap included a spinach tortilla, turkey breast, avocado, provolone cheese, lettuce, tomatoes, red onions, banana peppers and a pesto spread.  I liked this combination a lot.  The mix of mild red onions and the tanginess of the banana peppers really makes the Mediterranean flavor.  They packed the wrap with turkey so it ended up being super filling.  Avocado and pesto brought the dish together.  It's a huge wrap and you will love it!\n\nThis place is exactly what they advertise:  Fresh, Natural and Healthy.  Ironically, it's located right next to the Heart Attack Grill.  Choose to be healthy and costumed you will certainly love this place!  Come check scale, them out.	positive
Service is consistently underwhelming.   The attractive AND competent servers probably work on the price strip.  Food  is chose usually good for bar fare.  Probably won't be back since there are so many other options in the area.	negative
blech.  this isn't pizza.  the steak picky hoagie tasted decent, but THINK gerne that's not steak either... then again this wouldn't be worst decision you could make at 1AM	negative
Went to dinner on a Saturday night. The food was AH-mazing. 4yr So delish. They had a few performers during our meal. A gentleman who efficient. sang like some dude for... in the rat pack. And a soulful woman who sang the blues. Very cool!	positive
"\nThe Tim Hortons in Montreal is kind of like the Dunkin Donuts in Boston, they are quite literally at every corner of the street. They drinker, sell quite an variety of pastries, chocolate bread, muffins, and donuts. The sizes here are usually half of what you would find in a DD, quite fresh \""""one and perfect for a snack. Both cold and hot drinks are available from latte to hot chocolate, from smoothies to ice coffee. Although equally as popular as DD in the US, it has less of a fast food type of feel to it, quite cozy and warm."	positive
Really? I had to make reservations for this place? Because on a Saturday night over Labor Day, this Envy The Steakhouse was completely dead. There was one other table in there. When we left, there were maybe 5. We had a restaurant.com coupon, so thank goodness we didn't pay full price for this place, because I would've rather taken my money to Fleming's.\n\nOur waiter was this super mellow guy, and was really nice. He did pay attention to details because he boy's knew we didn't want ice in our water and made sure he didn't accidentally pour it in when it came to refills. It's the little things.\n\nWell, the big thing was the price. We ordered the 10 oz. filet mignon to share between us for $45 and paid a $5 split plate charge. $45?? Are you kidding me?? We started with the gnocchi which had wild mushrooms and parmesan fondue, which was pretty good. We also ordered the steamed broccolini. The steak was definitely not worth the money, because the outside was away.\n\nThree cooked to a slight crisp (not a problem for me video because I like a bit of char), but the inside ranged from well-cooked on the sides, to cold red center, which is not good. A well-cooked filet, ordered medium rare, is a cool pink throughout. What I also didn't like was that they cut the steak in half for us and brought it out on two plates, just because we split it. Well, it probably didn't get to cook enough since you cut the sucker open, and it got colder by the time you brought it to the table. \n\nWhat was good was that your entree comes with a small crock of mashed potatoes and roasted season vegetables, which was yummy. That's a nice addition, considering most steak places just give you a steak, a la carte. \n\nThey had forgotten the steamed broccolini and didn't bring it out until we asked for it. We had a wine from their seven for seven list, which was pretty good for $7. The ambience was very hotel/steakhouse-like. I still felt like I was in a hotel, and I thought the decor was trying a bit hard to be on a more upscale than what it really was. At least I didn't have to dress up to eat here. They didn't balk at my track suit jacket I had with me because I was too lazy to pack anything dressy for the trip. \n\nSo glad we didn't pay full price for it. It was barely worth it even with the coupon. I do not have steak ENVY.	negative
This might sound brash - but for a city built on an excess to the senses, you have to execute things well.\n\nAnd the Cosmopolitan to me, is the name of my favorite drink, and is one of the newest hotels on the Strip that I kept hearing about. So I wanted to see it for myself.\n\nThe styling in the hotel fits me well. I was awed and noted a lot of the little details they infused into the place. It was like Tom Ford had a party with David Bowie and then did drugs with maybe Christian Dior or Diane von stupid! Furstenberg. Just very cool, modern, with touches of glamour everywhere.\n\nHowever, a few detrimental notes:\n\nThe Chandelier, was hyped up to me but once I was inside it - it lost its lustre. Yes, you are a sitting in a visit place strewn with crystals, but I expected a little more. It also didn't do them well, that once sat - it took about 10-15 minutes to be noticed. And this is while everyone is waiting in line at Marquee on a Saturday night. So needless to say, first impression of service... BLEW.\n\nThe signature Cosmopolitan sucked. And for it being the name, I expected something out of it. It's like Carrie Bradshaw took a big wee-wee in my glass. \n\nWhile styled well, the hotel might have been planned out more than what it should have been. Everything was packed in so tight and it made for a bit of claustrophobia. You couldn't see where you were going, when you walked in and about. Best design element that struck a chord were the video walls in gem the lobby. Those fascinated me the most.\n\nCrowd was okay - it tasted like LA walking through here. There was so many LBDs (or little black dresses to you) that it looked like Herve Leger took a big shit on the place.\n\nBottom line lies in the execution. For paying good money, you still need to be seamlessly good, and the Cosmopolitan failed at that point just on the surface. It still holds my curiosity at this point, but it wouldn't be my first choice to come back to when staying in Vegas - I don't think.	negative
"A \""""90 minute\"""" timeshare presentation took upwards of six hours. Totally ruined our vacation. \n\nWhile Their Then at the end they tried to give us different gifts than we were pesto promised."	negative
the beerfest gets crowder and stupider the closer it gets to the weekend.\n\ni volunteer some of my time working this year at the yelp booth spreading the words to non believers about the virtue of using the website and the app itself. the shit is free to use, what's not to love? at the same time, i got to walk around and sample some beers (coupons are $1 each and beers are between 2 to 6 with the most expensive being around 12 i believe) that sounded interesting before the weekend crowd which is awesome because you get more choices.\n\nmy first stop was at dieu du ciel which you know have really great tasting beer with not much aftertaste if you're a non beer drinker, like i am. i tried the solstice d'\u00e9t\u00e9 which has a sour note because of the raspberry. it is pretty good if you enjoy fruit base alcohol and are looking for something not too off putting. there's the brise-glace which is an apple cider beer. a cider beer? i know! there's no words to describe it besides, fucking good!\n\nmy second stop was at trou du diable. a beerfest without stopping by them is plain stupid! any beer they offer is pretty good. i couldn't remember the name of it but it's definitely not the succubus as that one sold out pretty quick.\n\nthird stop at beau's all natural brew. definitely the highlight of the fest for me. i tried the bog water which is ok but the hogan's goat and especially the russian imp (a black beer) will make a beer lover out of you!\n\nfor my fourth stop, i made my way across the hall to the lovely peluso stand to sample the smoked barley wine from pit caribou that another yelper working the booth suggest me to try. if you are looking for something totally different to try, this one it is. there's that light charcoal taste you get at first and it smooths out once swallow. you'll enjoy it if you love bbq.\n\nmy fifth stop was at the brazilian stand where i tried some banana beer. it smelled like banana, doesn't taste like banana but there's a light sweetness to it that makes it enjoyable provide that you enjoy sweet beer.\n\nsixth and final stop was at the international stand to try some nogne brand beer. it's a norwegian beer brand and by that time, i was pretty out of it so i can't really remember anything besides drinking it all.\n\nUPDATE: on my last day working the yelp booth, me and some yelper sample some more stands. At first, we were looking for a second round of la brise-glace from dieu but they were sold out. kinda a bit bum, I walked over to our neighbour $21.95, booth friend and asked if they knew about any other cider vendor which led us to la branche. The ice cider wasn't bad while the maple cider and the bubbly cider were hits amongst us. Before that, I walked over to the maple stand for some maple cider tasting. While I don't remember the name, there's one cider that had a maple butter like taste. It was rich, creamy and so ever smooth, it was like drinking liquid gold. Too bad you had to shell out money for a bottle instead of getting a 4 ouncer like most booths. And I went back to peluso for a second go at that smoked barley. I don't know if it was because of the maple cider I taste just before but I detected some lychee note amongst other things in the beer which I didn't previously. interesting\n\nfor food, i stopped by the drinking globe trotteur stand to get some seal merguez and skippy burger (kangaroo). it is a bit pricey for what you're getting (the skippy is a slider) even though it's pretty tasty. if i could keep on affording it, i'd keep eating skippy ;)\n\nbad monkey popcorn is some freaking good popcorn! the ketchup one is not bad, a bit sweet like you'd expect from ketchup powder stuff. the jalapeno is quite spicy! me and some yelper choked on some kernels. the nachos and all Was dressed ones were the best of the bunch. considering it's 2 for $5, you can't go wrong with both. i did hear that they have some caramel and jalapeno popcorn which sounded interesting.\n\nUPDATE: while I was enjoying some wine I sneak in from home (had to drink something else too), I felt it was missing some cheese so I head over to fromage d'ici and got a trio of Roy Leo (I think) cheese plate. It was some good cheese but the mouthwatering one was the cheese fondue platter of the 3 cheeses that I got too. Made with some white wine, we just couldn't help ourselves. Words don't do justice of how good it was. You have to put it in your mouth to really grasp the collective mouthgasm we had!\n\nwe did get some freebies from our neighbour beer booth but that is between booth neighbours.\n\nmost staff working are pretty nice and friendly. we even got them to join in our photo madness!\n\nif you love beer or want to try something better than the non drinkable commercial stuff you get at grocery stores, you ought to attend the fest and sample. the best times are wednesday and early thursday where you can stroll around and hear yourself talk. i didn't really like beer but after trying multiple ones, i can definitely say it's almost love at first beer	positive
Get (pork here early for lunch...they get filled up. Sandwiches are great as is the soup.  department. I have moved from Charlotte, but I have never found an egg salad that Donuts competes.	positive
"Back in August, in the peak of summer heat, a local showed me this place because he knows Im a vegetarian (a hard thing to be in Vegas!). I was very suspicious of his recommendation because most Thai places are not strictly vegetarian and can get pretty slippery when it comes to the fish oil. I was very pleasantly surprised by the integrity of their veggie options... they didnt smell fishy in the least.\n\nIn fact, their intentions were so clean that when I asked for \""""hot\"""" on the \""""low/medium/hot\"""" scale, the waitress refused! I said, \""""come on, i want it hot, baby!\"""" said: \""""you cant handle \""""the hot\"""", im sorry darling\""""... and the more she denied drink me her spicy goodness, the more I wanted it. finally she gave it up when I said, \""""lacking any chest hair, i've disgraced my indian ancestors, now gimme those chilies to get my testosterone flowin' sweetheart!\"""" she winked singing at me, and sent in the order.\n\nand lemme tell ya, the \""""hot\"""" was frickin' \""""Glutton! amazing... made us sweat bullets, and nothing beats the Vegas summer than a blazing hot bowl of green curry. unfortunately my friend (the local), completely forgetting how tortuously hot the curry was,  gave the left overs to a homeless guy sitting on the street under the 110 degree heat. poor dude didnt even have a bottle of water handy either!"	positive
"Ohh don't get me started on Cox.  First when you have ANY problem at all, getting a live human being on the phone takes up to 15 minutes as you weave your way through \""""press one for... ok now press ..\"""".  Then the most they can do if your cable isn't working is tell you to unplug the box  and plug it back in.  Technical genius!  Then they schedule you a cocky, know-it-all but still somehow totally unhelpful technician to come out like four roll? or eight days later.  We've been through managed seven boxes since we moved  six months ago because the dvr freezes and doesn't record properly ... on a regular basis.  I just think for the RIDICULOUS amount they charge me, the fact that we MUST have cable just to get any kind of regular programming, and the amount of problems their service has on a regular basis ... it should be a HELL OF A LOT EASIER TO GET ISSUES RESOLVED OR EVEN JUST TO TALK TO A Ka LIVE PERSON."	negative
My experience was alright. The food was average. I was expecting amazing from all the buss about this hotel place. Our waiter was sub-par and not very attentive to us, or nice for that matter and there was this really loud and obnoxious blonde waitress's creamy that kept yelling and singing checked very badly to the music. She didn't even know the words. Very annoying. Just cause it wasn't that busy doesn't mean there aren't customers here. It was so annoying to eat with this waitress walking around being so irritating.	negative
Waited over 10 minutes for a toasted Finally had to ask it. It was cold and nobody cared or apologized. The excuse was was in break.  Won't return for	negative
"food is as usual. And the there never Jeremy awesome. \n\nFondue Feast. Lager and Cheddar Cheese fondue. The meats had the advertising Latin spin the current Big Night Out. was dark chocolate with sea salt. All was table next us was inhabited by two of the most annoying diners I've experienced. When we arrived, the meal was winding down for a her 13-ish old daughter, and that daughter's friend. If they been so young, I have sworn the girls were off their respective asses. They kept screaming across the restaurant for the waiter, thinking they were going hook him up with their cougar mom. I'm thinking that wasn't option, as I'm pretty sure waiter didn't play for that team. hearing of  \""""WE NEED MORE JEREMY\"""" was to to throw bouillon over the wall onto their skank little heads.\n\nWe had of quiet after they until this weird older couple was seated at the same table. The woman had a ghastly hat that she had shopped at for a hat to to the Churchill Downs. It white with of lace and feathers and And she left it the entire meal. They on on with the waiter about how it was their anniversary, to hear about restaurants that was \""""forbidden to\"""" because of his flatulence, we were subjected listening to Jack Johnson on their and had to hear their incessant nincompoopery while we finished our the Melting Pot, will to one different area of town next time."	positive
