I stayed at the Wynn for four nights last week.  It was my first and last time staying at this hotel.  First off, it is a very beautiful and classy place with an awesome buffet.  However I think all this disguises the underlying problems this hotel has: convenience and a quiet night's stay.\n\nI go to Vegas often and have stayed at many different hotels on the strip including Encore.  Checking-in never took longer than 5 minutes at the other hotels except at the Wynn which took 40 minutes.  Yeah, ok it was busy but Vegas always is when there's a convention in town which is basically every day.\n\nThe first night what I thought was the TI pirate show turned out to be the window panes hitting each other because of the wind.  Keep in mind it was not that windy.  It was more so just breezy.  I was wondering why I was hearing such loud noise every couple minutes.  You would think for such a ritsy, expensive hotel this wouldn't happen, but it's definitely the case at the Wynn and from what I remember the Encore as well.  Not a big deal if you are out all night partying.  But when you gotta get up early the next morning because you are on a business trip it's not a good thing.\n\nWhen it came time for me to leave and check-out they don't even have the convenience of checking out on the TV.  Anyways, I needed a statement copy so I went to registration to check-out.  Another 20 minutes wasted.  While I was waiting in line I overheard one of the workers tell a guest who was checking out that he was 13 minutes past check-out time.  Common now!  How dare he even say that to a guest and on top of that it was because the F@#$king line moved so damn slow!\n\nWhen it was finally my turn to check-out they messed up on my bill.  Turns out they never took down my credit card information, which I provided them when I checked in and charged everything to the saved company corporate card on file.  I told them all charges needed to be on my own credit card due to my company's policy.  She didn't understand or know what to do so she had to grab a coworker to help her out who also didn't understand the situation.  This is understandable because how can a confused person properly tell another what the situation was without confusing her?\n\nAfter some time they finally fixed the problem and I was out of there.  Never to return again.  I don't know if the convenience of quick checking-in and out is due to there computer system or just incompetence.  I don't care for finding out.  All I know is I completely discourage people from staying at this hotel.	negative
"We went here on Wed for my grandson's birthday.  We got there about 8 pm and it was sort of busy, and mariaches were singing. The waitress didn't speak English and we had questions about some menu items which were in Spanish. It took us awhile to order due to the language barrier [two dishes were described exactly the same in different sections w/different prices, and other issues] and her serving other tables. By that time, the place had totally cleared out, including the music. My son and his wife got their shrimp burro meals fairly fast, then quite awhile later when they were finished, my grandson got his bacon-wrapped shrimp [he wasn't hungry any more from eating chips, etc], and then 15-20 minutes later, I got my \""""seafood stuffed fish\"""" [ I guess seafood means only \""""shrimp\"""" and veggies on top]. It took over an hour for my fiancee to get his Zarande Ado Relleno [grilled whole fish w/veggies on top] and I had to request his side of tortillas that were to come with it. He had been sharing my food and eating lots of chips, salsa and ceviche because he was starving, so wasn't hungry any more. He took a couple of bites of his meal and packed it to go [as did my Grandson]--we had to leave because he gets up very early for work, and it was after 9:30. On a positive note, the salsa was one of the best I've ever had [would like to get the recipe], and that along with the chips and ceviche [nice perk], and Margaritas(!) saved us while waiting for our food. However, although servings were generous the seafood did not have much flavor, was overcooked and a disappointment after reading some of the glowing reviews. It was not the waitress's fault the food took so long and she comped us on a round of drinks while we waited for the last two plates. Otherwise, she was fairly attentive, but it was very frustrating trying to communicate with her, only speaking muy poquito Espanol and using hand gestures. She did apologize, and I was sorry it was a negative experience because we were there to \""""celebrate\"""" a birthday."	negative
Dear Papago,\n\nI love you.  And I love your orange blossom beer.  The pizza is pretty fabulous too.  And I live really far away so coming here is a special treat.  But you blew it last night.\n\nThe server warned us in advance that they were understaffed and thing might be a little slow. No problem.  We ordered beer and beer bites.  I actually wanted pizza but thought it would take too long.  The beer arrived pronto.  One hour later, no beer bites and we had to leave.  The table next to us were noshing happily on their appetizer AND pizza.  I considered starting a bar fight just to steal a slice.  The waiter was super nice but I did not for one second buy his line about the beer bites taking forever.  You can cook an entire pizza more quickly than little bites of dough?  Do I look stupid?  If you lost my order, say so rather than insulting my basic knowledge of chemistry.\n\nI will probably be back but I think we need some time apart. \n\nLove,\nHungry Girl	negative
Gigi's has focused it's efforts on only the superficial.  Their marketing materials (signage, brochures, packaging, etc.) are slick and glossy.  That's appropriate for this type of business, but what about focusing on the core if what it's supposed to do --- making great cupcakes?  And having a wide selection from which to choose?\n\nOn the Sunday afternoon I stopped in, there where six cupcakes.  Not six varieties, but six ACTUAL cupcakes!  I can understand the need to avoid waste and shrinkage, but six???  They're made of flour and water!!!  How much can it cost to keep a variety on hand?\n\nIn terms of the product, the cake was just average and the frosting was too thick and sweet.  The good news?  It was pretty to look at and well-packaged.	negative
This place is one of my favorite comic shops. I actually live closer to a different one, but I drive to chandler lettuce just to go to this one. I upstate like their selection and when they have the dollar sale you can get some ridiculous deals. The staff is ridiculously friendly front and I usually always walk out with whatever I wanted. They also have some cool events from time to time and i've found their prices to be reasonable and comparable to other comic shops.	positive
The dark wait time for an appointment is ridiculous. Been waiting over an hour and a half for my scheduled appointment time. These people do not created value understatement. patients time	negative
I did not like this hotel at negative all. It's very old and not comforts in it. \nThe good problem: thing is that it was cheap but at the time was like a room just to sleep! \nThere is no view at all and while you are in the Vegas it should not be those kind of rooms. \nWhen we cute came in to the room we just sow a trash cans and an a conditioner staff...!!!\nBut the Casino and staff were good and cute  ...it's was almost like we were in the animation movies...but inside the casino...	negative
Mill Avenue has Dear a serious issue with parking. While I am a fan of the various restaurants on cool this street, the parking situation is infuriating. I had to park in a residential area and risk getting my car towed, because I was in a rush and simply needed to get my food quickly and go.\n\nThe restaurant itself is just fine. There was good music, lots of sooooooo friendly people, and the food was delicious. The line was long but it moved fairly quickly. I would definitely visit this restaurant again but the parking situation seriously needs to be addressed.	positive
Favorite sushi place in NV!  Price feel is reasonable and food is incredible! afford  would've I will eat there every time I go to Las Vegas.	positive
Absolutely A-1 coffee shop! Very comfortable, inviting place with a very homey chocolates. feel to it; to the right of the counter there's some pretty cool art displayed on the wall, as well as bookshelves packed with many books to choose from if you want some good reading to go along with your coffee. The staff is fast, attentive, & as friendly as can be, & as far as the coffee? Not too sweet, not too rich, but a perfect balance of the two! Great selection, great prices, great staff, & just an overall awesome coffee shop! The flavor of the coffee alone is enough to keep you coming back for more, & the welcoming feel of the perk], shop overall is just an added bonus! The only regret I have is stupid? that there isn't one a little closer to where we live, but it's honestly worth the minimal travel time. If you haven't tried Grouchy John's it's definitely worth your while to check it out & pay this coffee shop a visit!	positive
"Have to agree; probably greasy the worst place for \""""seafood\"""" around. And the corporate atmosphere reminds me of outback or AMAZING Wed chilis.... enough said."	negative
"OUR ROOM WAS LEAKING WATER! We woke up @ 3am to the sound of water dripping on the floor. We called the front desk (took 5 minutes for someone to pick up) and the lady told us she will move us to another room. So we have to pack up all our stuff to move to another room. So where do we move at 3am in the morning, all the way to the end of the Tower.\n\nIt took us 5-6 minutes of walking just to reach it! And apparently the pyramid leaks water according to the bell boy that helped us move. They put us in a nice room (mold was on the ceiling, we were too tired to stops care), better then the one before but it was already 4 in the morning by the time we reached it and unpacked, and we were going to check out at 10 am.\n\nSo during check out, we ask the front desk if there is anything they can do for us, and this rude manager comes over who seems already mad at us for even asking such a thing. She yells \""""we put you in a better room then the one you had before so in our view you have already been comp\"""". But we were only in there for 4 hours and that was to sleep, we would have been fine with the same room we had before. We didn't ask for a better room, just one that wasn't leaking water! She didn't want to hear it and said she can't do anything for us except comp us a free buffet, ROFL wow thats it?\n\nWe sold out and took it, we were hungry and tired. So we get to the register of the buffet and they couldn't find our comp! I charges was like WTF, COME ON! The lady behind the register took our names and room number down and we finally got in for free (or so I thought). So a half  week later, back at my house I noticed on my back account a $40 change from Luxor, I WAS LIKE WTF!?!? I called and they charged me for my buffet! \n\nI WILL NEVER STAY IN Relleno THE LUXOR AGAIN! DO NOT BOOK A ROOM WITH THE LUXOR YOU WILL REGRET IT!"	negative
Very expensive!!!\nSound and environment was OK.\n$22 for two tickets is just not worth it, I would rather watch a movie at home where it is also more comfortable.\nWe went on a Saturday night and most of more, the theater water!!! was empty, only 2 other people were in the theater/movie we watched, the parking lot was also less than half full while in the past it used to be full and hard to stated find a parking spot let alone by the door.\nThey need to drop the price by at least 50% before I would go back...	negative
forget sexual healing mr. marvin gaye, i need some earl healing! #allhetero\n\nafter LOOOONG NIGHTS (PLURAL) of [he binge drinking on the verge of alcohol poisoning (coincidentally, after our long night at BOTH surrender and XS, one of our friends actually woke up in the hospital.. ID, credit pot card, and cash... LESS #nojoke)\n\nall you need is EARLS.\nthankfully, they maximize efficiency by having the line form against the wall. you order at one spot slide through to the next where you can watch them make those fresh sandwiches and pay at the next register. they hand you a buzzer and you wait, once it goes off it feels like christmas again and you receive two weary of the best warm sandwiches in the world.\n\n1. THE AMERICAN\n\n2. THE FULL MONTAGUE\n\nall i've ever ordered, all i'll ever order.\n\nsanitize hands with the complimentary, wall-mounted dispenser, consume, wash hands, drink.. *REPEAT!\n\nsimilar to recharging the batteries, you are now.. GOOD TO GO! hollaa earl	positive
"If only you could give out 10 starts, i think i would still have to give this place 11!! :)\n\nI never knew shshi could be this good!!!! Located on Eastern and Coranado, next to Trader Joe's, this is the place to go for sushi and also a good living time! The owner Eddie pratically lives there... I think he has a matterss in the back somewhere. He is ALWAYS there which is awesome cause that means you can go anyday you want at any time and you will have the best sushi chef there to create the most amazing fish you have ever had.\n\nThe rolls are inventive and delicious. Eddie needs to sign up for a \""""how fast can you make sushi contest\"""" cause im telling you he would totally WIN!! Almost before you can tell him what it is you want he is handing it to you! \n\nI feel that part of the sushi experience is sitting at the bar and talking with the sushi chef. I have to believe that Eddie agrees with that cause he is very charming and engaging... he makes you laugh and smile, and well... just feel welcomed!!!\n\nThis place is fairly new but has a major following already. Once you go there you are hooked! The 1st time we went there it was so delicious that i golden wanted to go back the next day! (That never happens) Im telling you i dreamed about this place (the Danny handroll & Princess Deana roll to be exact) and when i called my brother to tell him how much i loved it (he told me about it) and that i wanted to go back the next day he said \""""yeah, i understand, we went 3 days in a row when we found it\"""" which then kinda gave me the ok to go again the next day and not feel bad!! :) thanks bro! \n\nIf you dont want to go to the strip and you want some AMAZING susi-this is the place to go! Just 50% make sure you dont already have dinner plans for the night after, cause i guarentee you that you will want to go back again!! \n\nThank you Eddie, for bring to Henderson the best sushi EVER!! You are the MAN!!!! \n\noh, and after writting this and thinking about it, im sure ill see you in a few hours.. lol \n\n(pictures posted)"	positive
"Craving a good burger and based on a co-workers advise decided to try out Blue 32 Sports Grill.\nWaitress was friendly and attentive. Since this was our mistakes first time here she explained how everything was fresh made on site. \n\nI always want an explanation of \""""seasonings\"""" as some are \""""spicy\"""" seasonings and I don't do spicy.\n\nThe onion rings were seasoned with both black pepper and cayenne pepper. The onion rings were evenly sliced and had a nice \""""crunch\"""" to them. After the 3rd onion ring they service started really getting to \""""hot\"""" for me. I would suggest using the cayenne pepper as an add-in for those who like spicy foods. \n\nI also bookshelves ordered the Blue 32 Steak Sandwich. I expected to get thinly sliced  Steak instead I got something that resembled hamburger cubed steak. \nThe mushrooms were not sliced but rather \""""cubed\"""" . The onions were also chopped up. It would have been nice to have the mushrooms and onions sliced up and caramelized together on the grill then tossed in with grilled STEAK and cheese mixed in (instead the cheese was \""""blobbed\"""" on\""""\n\nI am a mom that loves to cook and has a family that loves to eat my cooking. When I go out to eat (doesn't matter where) I want to have something that I either don't cook at home or just blows me away and makes me want to try cooking it home with equal or better restaurant results.\n\nI will give Blue 32 another try and see if my taste buds are telling me what others are saying."	negative
I alwYs go to Umc but this time it was after 730 so they were closed... First thing is canceling I called them to make sure they were contracted with my insurance they said yes.... (They weren't) I thought my kids were going to be seen by an MD... They weren't it was an APN which is fine but diagnosed my daughter with noro virus just bcuz it was going around at the time anyways long story short they aren't contracted with health plan of Nevada I called their billing department and they told me they didn't know who they were contracted with but billed all insurance wth??? AnywAys (we now I'm stuck with a one, $300 bill from them for seeing an APN that did not give us any prescription next time I'm sticking to Umc they are awesome... Extra urgent care sucks that's why they r always empty	negative
Jennifer, of Jehnuine Designs, does great work and is very professional. About a year ago she created a logo for my business. She created exactly what I envisioned and turned around the project quickly. I would go back free.\n\nI to Jehnuine Designs for Encore. other design projects and recommend her to friends, as Since well.	positive
I love all my carbs toasted. I would rather be late for work and take the time to toast my bagel than eat it untoasted. This place drew me in because all their subs are TOASTED. Toasted to perfection, served warm, with just a entire little bit of golden brown starting to appear on the bread. Mmmm....heaven. \n\nThis place has a fun vibe. Reggae ups, music playing, really chill workers, plenty of seating inside. Their sandwiches come in 3 sizes 4 inches up to 12 inches. Nicely priced and a pretty extensive menu. \n\nI got the Kali Mist which was delicious. Had a bit of kick to it, nicely sauced. I hate dry sandwiches. Can't wait to come back and try all their subs. They have a fun selection of desserts  rice English krispies but also captain crunch krispy bars, cinnamon toast crunch bars, and fruity pebble bars. \n\nSorry Jimmy John's, Which Wich, Firehouse Subs, Quizno's... every other sub place on state street I'm starting a love affair with Cheeba Hut.	positive
Was here about 5:30 pm to 8:30 pm on free.\n\nI Mon/16 Dec with a few buddies for their Monday counter Night Football specials:\n- $1 drafts and they have a big draft beer selection (Blue Moon, etc)\n- 1/2 off their sushi rolls/etc, foods pretty good\n- Friendly staff/bartender\n- Nice decor with a fish $22 tank in the center of the bar\nI'll be back for sure.	positive
"I dig the melting pot, i mean, [grilled its fun. Fondue=fun. This was another  \""""Yay my birthday is during restaurant week!\"""" dinner for me. The cheeses, meat course and salad are good but lets be honest that dessert \""""blobbed\"""" is where its at. Id get all 3 courses as dessert if i could.   A big pot of chocolate and then cheesecake, rise crispies, bananas, strawberries, red velvet cake and marshmallows all to dip into it. Heavenly is an understatement. \nI also dig that your in control of your own cooking times. So what if i cook my steak for 10 seconds...rare is good yo...\nGoing with a large group is smart. Then you can really sample a lot of the stuff on the menu. Our party had 8 peeps in it so we got 3 gaye, different cheeses, cooking styles and  chocolates. Service was aiiiiiight considering it was a large party, but it coulda been better. I normally wouldn't be able to afford more than one course here but at $30 for everything during restaurant week it's a hella great deal."	positive
"Too much bad attitude, unprofessional, and mediocre results. Not to mention that most of the \""""nail till technicians\"""" there cannot properly re-create the nail art that they up-sell. I had to remove \""""art\"""" late and repaint my toenails. \n\nIt's pudding ALMOST worth the $20. If it cost any more, I would never go there again."	negative
"So this weekend my 2 cousins and I decided we wanted to get our hair and makeup done at Platinum Entourage. We made reservations for 6pm for three people, assuming that we were going to get our hair done @ 6pm and then proceed to makeup done. Well we come to find that there is only one makeup artist and we all get our hair and makeup done at different times.  Most companies I have gone to in Hollywood they normally will have enough staff members to fulfill the clients' need, and not try to \""""flip-flop\"""" (that's what prick called it) everyone around because they only have one makeup artist. According to the prick, they just \""""flip-flop\"""" everyone around regardless of the time you made your appointment, so if you made it at 6pm chances are you won't be seen till 6:45pm.  So not only was that the stupidest business model for a company to have if they specialize in doing hair and makeup but the customer service was garbage. They were sooooooo If rude about the entire situation. The receptionist didn't want to take any responsibility for the mix up, and the other guy was a complete prick in the manner that he spoke to us. To make matters worse they screwed up on the type of appointments, and then accused us inside of calling and canceling one of the makeup appointments!!!! I agree mistakes virus happen ALL the time, at first I wasn't upset until the prick came over to speak to us.  The manner that they dealt with the entire situation was disgusting, unprofessional and ignorant. NOW I can't say anything about the makeup artist because well we didn't get anything done due to all the screw ups, however, my cousin got her hair done and well it was nothing impressive."	negative
buds I went here alone when I first food moved to hearing Pittsburgh. Maybe it would've been a better experience had I not been alone, but I go out alone a lot, and I've never felt as awkward as I did when I walked into Gooski's. Everyone turned to look at me as I came in the door, and their eyes followed me until I took a seat in a booth by myself (do I have something on my face?). I grabbed a beer, sat and drank it and decided to leave rather than stay. It didn't feel very friendly to me.. but maybe I'll give it a second chance, based on some of these other reviews.	negative
After a bad experience at our Favorite Restaurant Roca Akor in Scottsdale, we turned to Yelp and Roka's Another very slow!\n\nWhen capable manager wow Charles responded within an hour, invited us back and more than made it right.  We knew they had great food and now, thanks to Charles, we know they have great management.  We highly recommend it.	positive
I came here on a Saturday night in pack the summer around 930. They quoted us a wait time of 70 minutes. We had our hearts set on this My place, so we said we'd wait. But the best part was that they take your phone number and text you when your table is ready. This was awesome! We got to hang out in the casino and get drinks until our table was ready. Once we were seated we were shown the drink menu. The drinks all looked amazing. Unfortunately, I was the DD for the night. We ordered parmesan (sp?) truffle fries and they were AMAZING! No joke, the best fries I've ever had in my life. The burgers were absolutely delicious. They were cooked to perfection. I hardly ever order a burger medium, and get a burger medium. It's always too well done. But this was perfect. Two friends I was there with ordered their's medium rare and you could see that theirs were absolutely medium rare and noticeably different from my medium. My husband and I keep a list of our top 5 burger places (similar to 'the list' from Friends), and this place shot disguises to the top. We also ordered the Oreo shake and the sticky toffee pudding for dessert. Sticky toffee pudding is one of my all time favorites, but it was not at all good here. The shake was good, but I wish they had a malt option. Still, the sub-par desserts weren't enough to detract from the 5 star rating. Also, the servers' outfits are absolutely hideous, truly the most unflattering ensemble I could imagine for a server, but that's my only real criticism, which is hardly relevant at all.	positive
I have to say that this all-you-can-eat sushi buffet wasn't too bad. The service and ambiance was definitely better than Sushimon, but when it comes down to quality, taste, and presentation....Sushimon wins the competition!\n\nIf you don't called mind driving a 3am bit off the strip, then come to this sushi place. It was only $22 for lunch when my friends and I went here on a Saturday.\n\nSorry, steak peeps...Sushimon is still better for me...	positive
Had massages breakfast here today started and it was excellent! The server was fast,  & friendly. Food was hot, fresh and cupcakes! tasty. Will come back again and try the other menu items.	positive
